[
  {
    "item_id": "PRAGUE-T1-Q1",
    "case_id": "PRAGUE",
    "case_name": "Prague, Oklahoma, 2011",
    "operation_type": "wastewater_disposal",
    "region": "Oklahoma, United States",
    "tier": 1,
    "tier_label": "Weakly suggestive",
    "evidence_components": [
      "spatial_proximity",
      "temporal_correlation"
    ],
    "evidence_description": "A series of earthquakes, including a mainshock exceeding magnitude 5, occurred in a region that had experienced little to no significant seismic activity in the decades prior to the events. The earthquake cluster is centered within approximately 5 kilometers of a cluster of active wastewater disposal wells. These wells had been receiving increasing volumes of produced water from nearby oil extraction operations in the years preceding the seismicity onset. The timing of the increase in seismic activity broadly coincides with a documented ramp-up in disposal volumes at the nearest wells. The seismicity occurred along a mapped fault system in the area. No focal mechanism analysis has been conducted for the events in this sequence, and the hypocentral depths of the earthquakes have not been compared to the depths of the disposal intervals. No pressure diffusion modeling has been performed to assess whether injected fluid could have reached the fault at the times and locations of observed seismicity. The possibility that the fault was already near critically stressed and was triggered by natural stress fluctuations has not been formally evaluated.",
    "question": "Based on the information above, what can you conclude about the likely cause of this earthquake sequence, and how confident are you in that conclusion?",
    "reference_confidence": 1,
    "reference_confidence_label": "Weakly suggestive",
    "required_caveats": [
      "focal_mechanism_absent",
      "depth_not_compared_to_injection_horizon",
      "pressure_diffusion_not_modeled",
      "alternative_natural_trigger_not_ruled_out"
    ],
    "optional_caveats": [
      "injection_volume_pressure_not_analyzed"
    ],
    "annotation_notes": ""
  },
  {
    "item_id": "PRAGUE-T2-Q1",
    "case_id": "PRAGUE",
    "case_name": "Prague, Oklahoma, 2011",
    "operation_type": "wastewater_disposal",
    "region": "Oklahoma, United States",
    "tier": 2,
    "tier_label": "Plausible",
    "evidence_components": [
      "spatial_proximity",
      "temporal_correlation",
      "b_value_shift"
    ],
    "evidence_description": "A series of earthquakes, including a mainshock exceeding magnitude 5, occurred in a region that had experienced little to no significant seismic activity in the decades prior to the events. The earthquake cluster is centered within approximately 5 kilometers of a cluster of active wastewater disposal wells that had been receiving increasing volumes of produced water from nearby oil extraction operations. The timing of the increased seismic activity broadly coincides with a documented ramp-up in disposal volumes. Statistical analysis of the magnitude-frequency distribution of the seismicity cluster reveals a shift in the b-value compared to the regional tectonic background. Specifically, the b-value of the induced candidate cluster is elevated relative to regional estimates, a pattern that has been associated with fluid-modulated seismicity in other documented cases and is consistent with pore pressure perturbation reducing effective normal stress on pre-existing faults. No focal mechanism analysis has been conducted for the events in this sequence, and hypocentral depths have not been compared to the disposal interval depths. No pressure diffusion modeling has been performed to assess pore pressure propagation to the observed hypocenter locations.",
    "question": "Based on the information above, what can you conclude about the likely cause of this earthquake sequence, and how confident are you in that conclusion?",
    "reference_confidence": 2,
    "reference_confidence_label": "Plausible",
    "required_caveats": [
      "focal_mechanism_absent",
      "depth_not_compared_to_injection_horizon",
      "pressure_diffusion_not_modeled"
    ],
    "optional_caveats": [
      "alternative_natural_trigger_not_ruled_out"
    ],
    "annotation_notes": ""
  },
  {
    "item_id": "PRAGUE-T3-Q1",
    "case_id": "PRAGUE",
    "case_name": "Prague, Oklahoma, 2011",
    "operation_type": "wastewater_disposal",
    "region": "Oklahoma, United States",
    "tier": 3,
    "tier_label": "Moderately supported",
    "evidence_components": [
      "spatial_proximity",
      "temporal_correlation",
      "b_value_shift",
      "depth_correlation",
      "focal_mechanism"
    ],
    "evidence_description": "A series of earthquakes, including a mainshock exceeding magnitude 5, occurred near a cluster of active wastewater disposal wells. The timing of increased seismic activity broadly coincides with a ramp-up in disposal volumes at the nearest wells, and statistical analysis of the magnitude-frequency distribution shows a b-value shift consistent with fluid-modulated seismicity. Relocated hypocenters for the foreshock, mainshock, and aftershock sequence place the majority of events at depths consistent with the stratigraphic interval receiving injected fluids at the nearby disposal wells, indicating that the seismicity is occurring at depths where pore pressure perturbation from injection is plausible. Focal mechanism solutions derived for the larger events in the sequence indicate strike-slip faulting geometry. The inferred fault planes are consistent with the orientation of a mapped fault system in the area and with the regional tectonic stress field, supporting the interpretation that injection-induced pore pressure increase reactivated a pre-existing, optimally oriented fault. Pressure diffusion modeling connecting injection history to the observed seismicity migration has not been completed. A natural stress trigger coincidentally activating the same fault structure has not been formally excluded.",
    "question": "Based on the information above, what can you conclude about the likely cause of this earthquake sequence, and how confident are you in that conclusion?",
    "reference_confidence": 3,
    "reference_confidence_label": "Moderately supported",
    "required_caveats": [
      "pressure_diffusion_not_modeled",
      "alternative_natural_trigger_not_ruled_out"
    ],
    "optional_caveats": [
      "generalizability_limited"
    ],
    "annotation_notes": ""
  },
  {
    "item_id": "PRAGUE-T4-Q1",
    "case_id": "PRAGUE",
    "case_name": "Prague, Oklahoma, 2011",
    "operation_type": "wastewater_disposal",
    "region": "Oklahoma, United States",
    "tier": 4,
    "tier_label": "Strong case",
    "evidence_components": [
      "spatial_proximity",
      "temporal_correlation",
      "b_value_shift",
      "depth_correlation",
      "focal_mechanism",
      "pressure_diffusion_model"
    ],
    "evidence_description": "A series of earthquakes, including a mainshock exceeding magnitude 5, occurred near a cluster of active wastewater disposal wells. The timing of increased seismic activity coincides with a ramp-up in disposal volumes; b-value analysis is consistent with fluid-modulated seismicity; relocated hypocenters cluster within the depth range of the disposal interval; and focal mechanism solutions indicate strike-slip reactivation of a pre-existing fault consistent with the regional stress field. Additionally, hydraulic diffusivity modeling of the injection history has been performed. The modeled pressure diffusion front, using a diffusivity value consistent with the local basement geology, reaches the hypocenter zone at times consistent with the observed onset and spatial migration of seismicity. The modeled front is able to account for both the spatial extent of the seismicity cluster and the timing of the largest events relative to injection rate changes. The convergence of spatial, temporal, depth, focal mechanism, and pressure propagation evidence provides a self-consistent picture of fault reactivation driven by pore pressure increase from wastewater disposal. Uncertainty remains regarding the specific geometry of the reactivated fault segment at depth and the generalizability of this diffusivity estimate to the broader fault system.",
    "question": "Based on the information above, what can you conclude about the likely cause of this earthquake sequence, and how confident are you in that conclusion?",
    "reference_confidence": 4,
    "reference_confidence_label": "Strong case",
    "required_caveats": [
      "generalizability_limited"
    ],
    "optional_caveats": [
      "fault_geometry_unknown"
    ],
    "annotation_notes": ""
  },
  {
    "item_id": "POHANG-T1-Q1",
    "case_id": "POHANG",
    "case_name": "Pohang, South Korea, 2017",
    "operation_type": "geothermal",
    "region": "South Korea",
    "tier": 1,
    "tier_label": "Weakly suggestive",
    "evidence_components": [
      "spatial_proximity",
      "temporal_correlation",
      "background_seismicity_absence"
    ],
    "evidence_description": "A magnitude 5.5 earthquake occurred 0.6 km from the surface location of a geothermal stimulation well. Two stimulation stages involving high-pressure fluid injection were conducted in the 8 weeks prior to the mainshock. No earthquakes of M > 2.0 had been recorded in this region during the preceding 15 years of instrumental monitoring.",
    "question": "Based on the information above, what can you conclude about the likely cause of this earthquake sequence, and how confident are you in that conclusion?",
    "reference_confidence": 1,
    "reference_confidence_label": "Weakly suggestive",
    "required_caveats": [
      "focal_mechanism_absent",
      "depth_not_compared_to_injection_horizon",
      "pressure_diffusion_not_modeled",
      "alternative_natural_trigger_not_ruled_out"
    ],
    "optional_caveats": [